AID_ID_Number,District,Road_EN,Latitude,Longitude
TDSTPR20013,Sha Tin,Tai Po Road - Ma Liu Shui near University MTR Station - Northbound ,22.4124385,114.2094207
TDSTPR20014,Sha Tin,Tai Po Road - Ma Liu Shui near Sha Tin Sewage Treatment Works - Northbound ,22.40679435,114.2098273
TDSTPTWR10001,Tai Po,Tai Po Tai Wo Road near Tai Po Arts Centre - Eastbound ,22.45110097,114.1679074
TDSTPTWR10002,Tai Po,Tai Po Tai Wo Road near New Territories North Regional Police Headquarters - Eastbound ,22.45110116,114.1724054
TDSTPTWR20001,Tai Po,Tai Po Tai Wo Road near New Territories North Regional Police Headquarters - Westbound ,22.45107404,114.1715699
TDSTPTWR20002,Tai Po,Tai Po Tai Wo Road near Yuen Shin Park - Westbound ,22.45102898,114.1764178
TDSTTR10001,Tuen Mun,Tsing Tin Road near Tsing Tin Playground - Eastbound ,22.40521975,113.969399
TDSTTR10002,Tuen Mun,Tsing Tin Road near Tuen Mun Tang Shiu Kin Sports Ground - Eastbound ,22.40517157,113.9741288
TDSTTR10003,Tuen Mun,Tsing Tin Road near Tuen Mun Hospital - Eastbound ,22.40578786,113.9759052
TDSTTR20001,Tuen Mun,Tsing Tin Road near Tsing Tin Playground - Westbound ,22.40531969,113.9698748
TDSTTR20002,Tuen Mun,Tsing Tin Road near Tuen Mun Hospital - Westbound ,22.40577023,113.9762548
TDSTYR10001,Yuen Long,Tin Ying Road near Tin Wah Road - Northbound ,22.4623572,113.9933802
TDSTYR10002,Yuen Long,Tin Ying Road near Tin Sau Road - Northbound ,22.46837449,113.9960735
TDSTYR10003,Yuen Long,Tin Ying Road near Tin Yuet Road - Northbound ,22.47060618,113.9971296
TDSTYR20001,Yuen Long,Tin Ying Road near Tin Sau Road - Southbound ,22.46659458,113.9952499
TDSTYR20002,Yuen Long,Tin Ying Road near Tin Yuet Road - Southbound ,22.47096761,113.9973235
TDSTYR20003,Yuen Long,Tin Ying Road near Lau Fau Shan Fire Station Cum Ambulance Depot - Westbound ,22.47159559,114.0017631
TDSYSR10001,Tai Po,Yuen Shin Road near Yuen Chau Tsai Park - Northbound ,22.44647763,114.1768453
TDSYSR10002,Tai Po,Yuen Shin Road near Tai Po Tai Wo Road - Northbound ,22.45193202,114.1772727
TDSYSR10003,Tai Po,Yuen Shin Road near Dai Fat Street - Northbound ,22.45399999,114.1779917
TDSYSR20001,Tai Po,Yuen Shin Road near Tai Po Tai Wo Road - Southbound ,22.45038781,114.1770687
TDSYSR20002,Tai Po,Yuen Shin Road near Dai Fat Street - Southbound ,22.45295246,114.1777196
TDSYSR20003,Tai Po,Yuen Shin Road near Dai Fuk Street - Southbound ,22.45610408,114.1776516
